{
  "bundle_sha256": "4ef25dae36d199fc0acdbb371a00fdb8d583c849ae06ceaa77e1387b76e98abf",
  "bundle_version": "2026.10.12.next4",
  "contract": "quiz-contract/v1",
  "private_grading": {
    "cinema-people-001": {
      "correct_option_id": "cinema-people-001-opt-1"
    },
    "cinema-people-002": {
      "correct_option_id": "cinema-people-002-opt-2"
    },
    "cinema-people-003": {
      "correct_option_id": "cinema-people-003-opt-3"
    },
    "cinema-people-004": {
      "correct_option_id": "cinema-people-004-opt-4"
    },
    "cinema-people-005": {
      "correct_option_id": "cinema-people-005-opt-1"
    },
    "cinema-people-006": {
      "correct_option_id": "cinema-people-006-opt-2"
    },
    "cinema-people-007": {
      "correct_option_id": "cinema-people-007-opt-3"
    },
    "cinema-people-008": {
      "correct_option_id": "cinema-people-008-opt-4"
    },
    "cinema-people-009": {
      "correct_option_id": "cinema-people-009-opt-2"
    },
    "cinema-people-010": {
      "correct_option_id": "cinema-people-010-opt-4"
    },
    "cinema-people-011": {
      "correct_option_id": "cinema-people-011-opt-2"
    },
    "cinema-people-012": {
      "correct_option_id": "cinema-people-012-opt-3"
    },
    "cinema-people-013": {
      "correct_option_id": "cinema-people-013-opt-2"
    },
    "cinema-people-014": {
      "correct_option_id": "cinema-people-014-opt-3"
    },
    "cinema-people-015": {
      "correct_option_id": "cinema-people-015-opt-2"
    },
    "cinema-people-016": {
      "correct_option_id": "cinema-people-016-opt-3"
    }
  },
  "private_question_metadata": {
    "cinema-people-011": {
      "editorial_tag_ids": [
        "domain:screen",
        "medium:film",
        "topic:film-production",
        "topic:literary-works"
      ]
    },
    "cinema-people-012": {
      "editorial_tag_ids": [
        "domain:arts",
        "domain:screen",
        "medium:film",
        "topic:actors"
      ]
    },
    "cinema-people-013": {
      "editorial_tag_ids": [
        "domain:arts",
        "domain:screen",
        "medium:film",
        "topic:actors"
      ]
    },
    "cinema-people-014": {
      "editorial_tag_ids": [
        "country:gb",
        "domain:arts",
        "domain:screen",
        "medium:film",
        "topic:film-production",
        "topic:opera"
      ]
    },
    "cinema-people-015": {
      "editorial_tag_ids": [
        "domain:arts",
        "domain:screen",
        "medium:film",
        "topic:film-production"
      ]
    },
    "cinema-people-016": {
      "editorial_tag_ids": [
        "domain:arts",
        "domain:screen",
        "medium:animation",
        "topic:animation-production"
      ]
    }
  },
  "published_at": "2026-10-12T00:00:00Z",
  "quiz": {
    "locale": "ru",
    "questions": [
      {
        "answer_kind": "single_choice",
        "difficulty": "medium",
        "difficulty_level": 5,
        "options": [
          {
            "option_id": "cinema-people-001-opt-1",
            "text": "Унесённые призраками"
          },
          {
            "option_id": "cinema-people-001-opt-2",
            "text": "Ледниковый период"
          },
          {
            "option_id": "cinema-people-001-opt-3",
            "text": "Лило и Стич"
          },
          {
            "option_id": "cinema-people-001-opt-4",
            "text": "Планета сокровищ"
          }
        ],
        "question_id": "cinema-people-001",
        "quiz_id": "cinema-people-20261011",
        "revision": {
          "number": 1,
          "sha256": "40fcdc839ef38248b739c8b2c2281fb2c87e8e9e3958b2d3bbe50530873d1a35"
        },
        "source": {
          "uri": "/app/quizzes/Cinema/People/cinema_people_20261011.json"
        },
        "stem": "Какой фильм получил «Оскар» за лучший анимационный полнометражный фильм на церемонии 2003 года?"
      },
      {
        "answer_kind": "single_choice",
        "difficulty": "medium",
        "difficulty_level": 6,
        "options": [
          {
            "option_id": "cinema-people-002-opt-1",
            "text": "Анна Пэкуин"
          },
          {
            "option_id": "cinema-people-002-opt-2",
            "text": "Холли Хантер"
          },
          {
            "option_id": "cinema-people-002-opt-3",
            "text": "Эмма Томпсон"
          },
          {
            "option_id": "cinema-people-002-opt-4",
            "text": "Дебра Уингер"
          }
        ],
        "question_id": "cinema-people-002",
        "quiz_id": "cinema-people-20261011",
        "revision": {
          "number": 1,
          "sha256": "89f032ff90d2187f929ca115320e89a2ff37043869fe1b503c441d5d107e3656"
        },
        "source": {
          "uri": "/app/quizzes/Cinema/People/cinema_people_20261011.json"
        },
        "stem": "Кто получил «Оскар» за лучшую женскую роль за фильм «Пианино»?"
      },
      {
        "answer_kind": "single_choice",
        "difficulty": "hard",
        "difficulty_level": 7,
        "options": [
          {
            "option_id": "cinema-people-003-opt-1",
            "text": "Холли Хантер"
          },
          {
            "option_id": "cinema-people-003-opt-2",
            "text": "Рози Перес"
          },
          {
            "option_id": "cinema-people-003-opt-3",
            "text": "Анна Пэкуин"
          },
          {
            "option_id": "cinema-people-003-opt-4",
            "text": "Эмма Томпсон"
          }
        ],
        "question_id": "cinema-people-003",
        "quiz_id": "cinema-people-20261011",
        "revision": {
          "number": 1,
          "sha256": "9800a150c57c39a5ec38cb2121e874ed3c9170ac8adab95ece494b76128ad809"
        },
        "source": {
          "uri": "/app/quizzes/Cinema/People/cinema_people_20261011.json"
        },
        "stem": "Кто получил «Оскар» за лучшую женскую роль второго плана за фильм «Пианино»?"
      },
      {
        "answer_kind": "single_choice",
        "difficulty": "medium",
        "difficulty_level": 5,
        "options": [
          {
            "option_id": "cinema-people-004-opt-1",
            "text": "1917"
          },
          {
            "option_id": "cinema-people-004-opt-2",
            "text": "Джокер"
          },
          {
            "option_id": "cinema-people-004-opt-3",
            "text": "Однажды… в Голливуде"
          },
          {
            "option_id": "cinema-people-004-opt-4",
            "text": "Паразиты"
          }
        ],
        "question_id": "cinema-people-004",
        "quiz_id": "cinema-people-20261011",
        "revision": {
          "number": 1,
          "sha256": "bfec6117b5665f062b408bda2c80bae74cd8125360f632a3858bce76076ed386"
        },
        "source": {
          "uri": "/app/quizzes/Cinema/People/cinema_people_20261011.json"
        },
        "stem": "Какой фильм получил «Оскар» за лучший фильм на церемонии 2020 года?"
      },
      {
        "answer_kind": "single_choice",
        "difficulty": "medium",
        "difficulty_level": 6,
        "options": [
          {
            "option_id": "cinema-people-005-opt-1",
            "text": "Пон Джун-хо"
          },
          {
            "option_id": "cinema-people-005-opt-2",
            "text": "Сэм Мендес"
          },
          {
            "option_id": "cinema-people-005-opt-3",
            "text": "Мартин Скорсезе"
          },
          {
            "option_id": "cinema-people-005-opt-4",
            "text": "Тодд Филлипс"
          }
        ],
        "question_id": "cinema-people-005",
        "quiz_id": "cinema-people-20261011",
        "revision": {
          "number": 1,
          "sha256": "ac8d05f432750b20363943b57d63aeef19132d26062361209c7a9330fe46d014"
        },
        "source": {
          "uri": "/app/quizzes/Cinema/People/cinema_people_20261011.json"
        },
        "stem": "Кто получил «Оскар» за режиссуру фильма «Паразиты»?"
      },
      {
        "answer_kind": "single_choice",
        "difficulty": "hard",
        "difficulty_level": 8,
        "options": [
          {
            "option_id": "cinema-people-006-opt-1",
            "text": "Дженни Бивен"
          },
          {
            "option_id": "cinema-people-006-opt-2",
            "text": "Маргарет Сиксел"
          },
          {
            "option_id": "cinema-people-006-opt-3",
            "text": "Джон Сил"
          },
          {
            "option_id": "cinema-people-006-opt-4",
            "text": "Колин Гибсон"
          }
        ],
        "question_id": "cinema-people-006",
        "quiz_id": "cinema-people-20261011",
        "revision": {
          "number": 1,
          "sha256": "8cddecda1cc0edcc6c85bef6621c55896e92b6af6d9870e7b8cb1ddcfa0a65f7"
        },
        "source": {
          "uri": "/app/quizzes/Cinema/People/cinema_people_20261011.json"
        },
        "stem": "Кто получил «Оскар» за монтаж «Безумного Макса: Дорога ярости»?"
      },
      {
        "answer_kind": "single_choice",
        "difficulty": "medium",
        "difficulty_level": 6,
        "options": [
          {
            "option_id": "cinema-people-007-opt-1",
            "text": "Ритвик Гхатак"
          },
          {
            "option_id": "cinema-people-007-opt-2",
            "text": "Мринал Сен"
          },
          {
            "option_id": "cinema-people-007-opt-3",
            "text": "Сатьяджит Рай"
          },
          {
            "option_id": "cinema-people-007-opt-4",
            "text": "Гуру Датт"
          }
        ],
        "question_id": "cinema-people-007",
        "quiz_id": "cinema-people-20261011",
        "revision": {
          "number": 1,
          "sha256": "44365ba78b7f184968157762d3092d39e68e4d86db4552b980d01b70a878b0dd"
        },
        "source": {
          "uri": "/app/quizzes/Cinema/People/cinema_people_20261011.json"
        },
        "stem": "Кто поставил фильм «Песнь дороги» (Pather Panchali)?"
      },
      {
        "answer_kind": "single_choice",